Type,English,Dutch (Nederlands),French (France),Spanish,Italian (Italy),Portuguese (Portugal),Greek (Modern),Polish,Bulgarian,Romanian,Slovenian,Croatian,Swedish
Code,en,de,fr,es,it,pt,gr,pl,bg,ro,sl,,
Title,Click right to start the survey.,,Cliquer à droite pour commencer le sondage,,,,Πατήστε δεξιά για να ξεκινήσετε την έρευνα.,"Kliknij w prawo, aby zacząć ankietę",,,Kliknite desno za začetek raziskave.,,
Intro,A data scientist is commonly defined by their ability to combine multiple skills. <a href="http://drewconway.com/zia/2013/3/26/the-data-science-venn-diagram">Drew Conway's Data Science venn diagram</a> (below) is currently the most widely adopted visualisation of data science skills.,,Un scientifique des données est communément définit par son abilité à combiner des talents multiples <a href="http://drewconway.com/zia/2013/3/26/the-data-science-venn-diagram"> Drew Conway's Data Science venn diagram</a> ,,,,Ο επιστήμονας δεδομένων καθορίζεται από τη δυνατότητα να συνδιάζει πολλαπλές δεξιότητες. Το <a href="http://drewconway.com/zia/2013/3/26/the-data-science-venn-diagram">διάγραμμα venn του Drew Conway</a> (παρακάτω) είναι η πιο διαδεδομένη απεικόνιση των δεξιοτήτων της επιστήμης δεδομένων.,"Inżynier baz danych, jest często definiowany przez jego/jej zdolność do łączenia wielu umiejętności. Diagram stowrzony przez Drew Conway’ego jest obecnie jedną z najbardziej rozpowszechnionych wizualizacji umiejętności wymaganych w tej roli.",,,Podatkovni znanstvenik je običajno definiran s sposobnostjo kombiniranja več spretnosti. <a href="http://drewconway.com/zia/2013/3/26/the-data-science-venn-diagram">Drew Conwayjev diagram podatkovne znanosti</a> (spodaj) je trenutno najpogostejša vizualizacija spretnosti podatkovne znanosti.,,
Studies,Studies have revealed a skills gap in data scientists globally.,,Les études ont révélées une différence dans les compétences des scientifiques des données,,,,Μελέτες έχουν αποκαλύψει ένα κενό στις δεξιότητες των επιστημόνων δεδομένων σε παγκόσμιο επίπεδο.,Badania wykazały istnienie poważnej luki w umiejętnościach wymaganych do tej roli na całym świecie.,,,Raziskave so pokazale globalno vrzel znanja med podatkovnimi znanstveniki. ,,
Aim,The aim of this survey is to:,,Le but de ce sondage est :,,,,Ο σκοπός αυτής της έρευνας είναι:,Celem tej ankiety jest:,,,Cilj te raziskave je:,,
Item_1,Identify data science skills in Europe,,D'identifier les compétences dans la science des données en Europe,,,,Η ανακάλυψη των δεξιοτήτων της επιστήμης δεδομένων στην Ευρώπη,Identyfikacja umiejętności wymaganych w dziedzinie inżynierii baz danych,,,Identificiranje spretnosti podatkovne znanosti v Evropi,,
Item_2,Identify key skills gaps,,D'identifier les différences de compétences présents,,,,Η ανακάλυψη κενών σε αυτές τις δεξιότητες,Identyfikacja luk w dostępności kluczowych umiejętności wymaganych w dziedzinie inżynierii baz danych,,,Identificiranje ključnih spretnostnih vrzeli,,
Item_3,Identify areas for new development of training,,D'identifier les zones de formation pour de nouveaux développements,,,,Η ανακάλυψη νέων πεδίων για ανάπτυξη της εκπαίδευσης,Zidentyfikowanie obszarów pod rozwój nowych szkoleń,,,Identificiranje področj za razvoj novih usposabljanj,,