Type,English,Dutch (Nederlands),French (France),Spanish,Italian (Italy),Portuguese (Portugal),Greek (Modern),Polish,Bulgarian,Romanian,Slovenian,Croatian,Swedish
Code,en,de,fr,es,it,pt,gr,pl,bg,ro,sl,,sv
Title,Thanks!,,Merci!,,,,Ευχαριστούμε!,Dziękujemy,,,Hvala!,,Tackar!
Text,"Thank-you for taking part in this survey, your input is very much appreciated.",,"Merci d'avoir pris part à notre sondage, votre contribution est grandement appréciée.",,,,"Ευχαριστούμε για τη συμμετοχή σας σε αυτή την έρευνα, η συνεισφορά σας είναι πολύτιμη.",Dziękujemy za udzial w naszej ankiecie.,,,Zahvaljujemo se vam za sodelovanje pri raziskavi. Vaši podatki so zelo cenjeni.,,Tack för att du deltog I undersökningen. Dina uppgifter uppskattas.
Success,Your data has been submitted successfully,,Vos réponses ont étaient correctement reçues.,,,,Οι απαντήσεις σας έχουν σταλεί επιτυχώς.,Twoje odpowedzi zostały zgłoszone z powodzeniem,,,Vaši podatki so bili uspešno predloženi.,,Dina svar skickades in med lyckat resultat.
Fail,There was an error. Please click here to email your results to us.,,"Une erreur s'est produite lors du processus d’envoi de vos réponses, veuillez cliquer ici pour nous envoyer vos réponses par email.",,,,Υπήρξε ένα πρόβλημα. Παρακαλούμε κάντε κλικ εδώ για να μας στείλετε τις απαντήσεις σας με email.,"Wystąpił błąd. Proszę kliknąć tutaj, aby wysłaćodpowiedzi do nas.",,,"Prišlo je do napake. Prosimo, kliknite tukaj in posredujte vaše podatke preko elektronske pošte.",,Det blev ett fel I inskickningen. Vänligen klicka här för att eposta dina svar till oss.